<?xml version="1.0" encoding="utf-8"?>
<festival id="prague-dreamland-2026" year="2026" xmlns:xsi="http://www.w3.org/2001/XMLSchema-instance" xsi:noNamespaceSchemaLocation="festival.xsd">
	<identity>
		<name>Prague Dreamland Festival</name>
		<edition>1</edition>
		<location>
			<city>Prague</city>
			<country>Czech Republic</country>
		</location>
		<dates start="2026-07-24" end="2026-07-26" days="3" />
		<theme>Fantasy Dream World (Tomorrowland-inspired)</theme>
		<genres>
			<genre>EDM</genre>
			<genre>House</genre>
			<genre>Techno</genre>
			<genre>Trance</genre>
			<genre>Drum &amp; Bass</genre>
			<genre>Hardstyle</genre>
		</genres>
		<description>
			Prague Dreamland Festival 2026 is a 3-day immersive fantasy-themed electronic music event set in the heart of Prague. Blending dream-world storytelling with spectacular stage design, large-scale visuals, daily fireworks, and top international &amp; local artists across EDM, House, Techno, Trance, Drum &amp; Bass and Hardstyle.
		</description>
		<tickets>
			<standard>1500 CZK</standard>
			<vip>3500 CZK</vip>
			<earlyBird>1200 CZK</earlyBird>
		</tickets>
		<links>
			<link>https://www.praguedreamland.cz</link>
			<link>https://instagram.com/praguedreamland</link>
		</links>
	</identity>
	
	<venues>
		<venue id="v1">
			<name>Mainstage - Astral Gate</name>
			<type>Outdoor Stage</type>
			<capacity>20000</capacity>
			<area>Letna Park</area>
			<address>
				<city>Prague</city>
				<postalCode>170 00</postalCode>
				<country>Czech Republic</country>
			</address>
			<facilities>
				<facility>Food Court</facility>
				<facility>Merch Booth</facility>
				<facility>First Aid</facility>
				<facility>Water Refill</facility>
			</facilities>
		</venue>
		
		<venue id="v2">
			<name>Underground Stage - Neon Cave</name>
			<type>Indoor Stage</type>
			<capacity>8000</capacity>
			<area>Holesovice</area>
			<address>
				<city>Prague</city>
				<postalCode>170 00</postalCode>
				<country>Czech Republic</country>
			</address>
			<facilities>
				<facility>Bar</facility>
				<facility>Lockers</facility>
				<facility>First Aid</facility>
				<facility>Rest Area</facility>
			</facilities>
		</venue>
	</venues>
	
	<performers>
		<performer id="p001">
			<name>Lunar Pulse</name>
			<role>DJ</role>
			<country>Belgium</country>
			<tags>
				<tag>EDM</tag>
				<tag>Progressive House</tag>
			</tags>
		</performer>
		<performer id="p002">
			<name>Vltava Voltage</name>
			<role>DJ</role>
			<country>Czech Republic</country>
			<tags>
				<tag>Techno</tag>
				<tag>House</tag>
			</tags>
		</performer>
		<performer id="p003">
			<name>Midnight Atlas</name>
			<role>Live Act</role>
			<country>Germany</country>
			<tags>
				<tag>Trance</tag>
				<tag>Electronic</tag>
			</tags>
		</performer>
		<performer id="p004">
			<name>Neon Orchard</name>
			<role>DJ</role>
			<country>Netherlands</country>
			<tags>
				<tag>Drum &amp; Bass</tag>
			</tags>
		</performer>
		<performer id="p005">
			<name>Iron Fairy</name>
			<role>DJ</role>
			<country>France</country>
			<tags>
				<tag>Hardstyle</tag>
			</tags>
		</performer>
		<performer id="p006">
			<name>Crystal Borough</name>
			<role>DJ</role>
			<country>United Kingdom</country>
			<tags>
				<tag>House</tag>
				<tag>EDM</tag>
			</tags>
		</performer>
		<performer id="p007">
			<name>Aurora Circuit</name>
			<role>DJ</role>
			<country>Sweden</country>
			<tags>
				<tag>Trance</tag>
				<tag>EDM</tag>
			</tags>
		</performer>
		<performer id="p008">
			<name>Prague Skyline</name>
			<role>Live Act</role>
			<country>Czech Republic</country>
			<tags>
				<tag>Electronic</tag>
				<tag>Techno</tag>
			</tags>
		</performer>
		<performer id="p009">
			<name>Velvet Reactor</name>
			<role>DJ</role>
			<country>Austria</country>
			<tags>
				<tag>Techno</tag>
			</tags>
		</performer>
		<performer id="p010">
			<name>Golden Rave</name>
			<role>DJ</role>
			<country>Italy</country>
			<tags>
				<tag>EDM</tag>
			</tags>
		</performer>
		
		<performer id="p011">
			<name>Starlit Harbour</name>
			<role>DJ</role>
			<country>Spain</country>
			<tags>
				<tag>House</tag>
				<tag>Progressive House</tag>
			</tags>
		</performer>
		<performer id="p012">
			<name>Echo Cathedral</name>
			<role>Live Act</role>
			<country>Poland</country>
			<tags>
				<tag>Trance</tag>
			</tags>
		</performer>
		<performer id="p013">
			<name>Nova Lantern</name>
			<role>DJ</role>
			<country>Denmark</country>
			<tags>
				<tag>Techno</tag>
				<tag>EDM</tag>
			</tags>
		</performer>
		<performer id="p014">
			<name>Basement Comet</name>
			<role>DJ</role>
			<country>Ireland</country>
			<tags>
				<tag>Drum &amp; Bass</tag>
			</tags>
		</performer>
		<performer id="p015">
			<name>Steel Unicorn</name>
			<role>DJ</role>
			<country>Belgium</country>
			<tags>
				<tag>Hardstyle</tag>
				<tag>EDM</tag>
			</tags>
		</performer>
		<performer id="p016">
			<name>Riverlight</name>
			<role>DJ</role>
			<country>Hungary</country>
			<tags>
				<tag>House</tag>
			</tags>
		</performer>
		<performer id="p017">
			<name>Obsidian Bloom</name>
			<role>DJ</role>
			<country>Germany</country>
			<tags>
				<tag>Techno</tag>
			</tags>
		</performer>
		<performer id="p018">
			<name>Pulse Architect</name>
			<role>Live Act</role>
			<country>Netherlands</country>
			<tags>
				<tag>Electronic</tag>
				<tag>EDM</tag>
			</tags>
		</performer>
		<performer id="p019">
			<name>Trance Scribe</name>
			<role>DJ</role>
			<country>Switzerland</country>
			<tags>
				<tag>Trance</tag>
			</tags>
		</performer>
		<performer id="p020">
			<name>Night Bazaar</name>
			<role>DJ</role>
			<country>Turkey</country>
			<tags>
				<tag>EDM</tag>
				<tag>House</tag>
			</tags>
		</performer>
		
		<performer id="p021">
			<name>Silver Compass</name>
			<role>DJ</role>
			<country>Norway</country>
			<tags>
				<tag>Progressive House</tag>
			</tags>
		</performer>
		<performer id="p022">
			<name>Thunder Mosaic</name>
			<role>DJ</role>
			<country>Finland</country>
			<tags>
				<tag>Hardstyle</tag>
			</tags>
		</performer>
		<performer id="p023">
			<name>Electric Folklore</name>
			<role>Live Act</role>
			<country>Czech Republic</country>
			<tags>
				<tag>Electronic</tag>
				<tag>House</tag>
			</tags>
		</performer>
		<performer id="p024">
			<name>Neon Sparrow</name>
			<role>DJ</role>
			<country>Portugal</country>
			<tags>
				<tag>EDM</tag>
			</tags>
		</performer>
		<performer id="p025">
			<name>Subway Siren</name>
			<role>DJ</role>
			<country>United Kingdom</country>
			<tags>
				<tag>Drum &amp; Bass</tag>
			</tags>
		</performer>
		<performer id="p026">
			<name>Prism Driver</name>
			<role>DJ</role>
			<country>France</country>
			<tags>
				<tag>Techno</tag>
				<tag>Trance</tag>
			</tags>
		</performer>
		<performer id="p027">
			<name>Rooftop Mirage</name>
			<role>DJ</role>
			<country>Spain</country>
			<tags>
				<tag>House</tag>
			</tags>
		</performer>
		<performer id="p028">
			<name>Cosmic Locksmith</name>
			<role>Live Act</role>
			<country>Germany</country>
			<tags>
				<tag>Electronic</tag>
				<tag>Techno</tag>
			</tags>
		</performer>
		<performer id="p029">
			<name>Amber Frequency</name>
			<role>DJ</role>
			<country>Netherlands</country>
			<tags>
				<tag>EDM</tag>
				<tag>Progressive House</tag>
			</tags>
		</performer>
		<performer id="p030">
			<name>Hardwave Herald</name>
			<role>DJ</role>
			<country>Italy</country>
			<tags>
				<tag>Hardstyle</tag>
			</tags>
		</performer>
		
		<performer id="p031">
			<name>Midtown Photon</name>
			<role>DJ</role>
			<country>Austria</country>
			<tags>
				<tag>Techno</tag>
			</tags>
		</performer>
		<performer id="p032">
			<name>Blue Cathedral</name>
			<role>DJ</role>
			<country>Poland</country>
			<tags>
				<tag>Trance</tag>
				<tag>EDM</tag>
			</tags>
		</performer>
		<performer id="p033">
			<name>Velvet Static</name>
			<role>DJ</role>
			<country>Sweden</country>
			<tags>
				<tag>House</tag>
			</tags>
		</performer>
		<performer id="p034">
			<name>Arcade Panther</name>
			<role>DJ</role>
			<country>Denmark</country>
			<tags>
				<tag>Drum &amp; Bass</tag>
			</tags>
		</performer>
		<performer id="p035">
			<name>Orbit Mason</name>
			<role>Live Act</role>
			<country>Switzerland</country>
			<tags>
				<tag>Electronic</tag>
				<tag>EDM</tag>
			</tags>
		</performer>
		<performer id="p036">
			<name>Neon Alchemist</name>
			<role>DJ</role>
			<country>Belgium</country>
			<tags>
				<tag>Techno</tag>
				<tag>House</tag>
			</tags>
		</performer>
		<performer id="p037">
			<name>Tramline Titan</name>
			<role>DJ</role>
			<country>Czech Republic</country>
			<tags>
				<tag>EDM</tag>
			</tags>
		</performer>
		<performer id="p038">
			<name>Shadow Carousel</name>
			<role>DJ</role>
			<country>France</country>
			<tags>
				<tag>Hardstyle</tag>
				<tag>EDM</tag>
			</tags>
		</performer>
		<performer id="p039">
			<name>Pulse Nomad</name>
			<role>DJ</role>
			<country>Hungary</country>
			<tags>
				<tag>Progressive House</tag>
				<tag>House</tag>
			</tags>
		</performer>
		<performer id="p040">
			<name>Basement Aurora</name>
			<role>DJ</role>
			<country>Ireland</country>
			<tags>
				<tag>Drum &amp; Bass</tag>
			</tags>
		</performer>
		
		<performer id="p041">
			<name>Gilded Circuit</name>
			<role>DJ</role>
			<country>Portugal</country>
			<tags>
				<tag>Techno</tag>
			</tags>
		</performer>
		<performer id="p042">
			<name>Starlight Syndicate</name>
			<role>Live Act</role>
			<country>United Kingdom</country>
			<tags>
				<tag>Electronic</tag>
				<tag>Trance</tag>
			</tags>
		</performer>
		<performer id="p043">
			<name>River Rune</name>
			<role>DJ</role>
			<country>Norway</country>
			<tags>
				<tag>House</tag>
				<tag>EDM</tag>
			</tags>
		</performer>
		<performer id="p044">
			<name>Neon Basilica</name>
			<role>DJ</role>
			<country>Spain</country>
			<tags>
				<tag>EDM</tag>